{
  "schema_version": 1,
  "project": "aboutme",
  "environment": "production",
  "site": "https://aboutme.vn",
  "source_repository": "https://github.com/dannyota/aboutme",
  "platform": {
    "provider": "aws",
    "orchestrator": "ecs",
    "region": "ap-southeast-1"
  },
  "observed_at": "2026-10-02T03:20:00Z",
  "stale_after": "2026-10-02T03:23:00Z",
  "summary": "verified",
  "release": {
    "version": "v0.5.21",
    "commit": "d73f40430000000000000000000000000000000d",
    "deployed_at": "2026-10-02T03:12:00Z"
  },
  "components": [
    {
      "name": "server",
      "image": "ghcr.io/dannyota/aboutme-server",
      "running_images": [
        {
          "digest": "sha256:9e0d9e0d9e0d9e0d9e0d9e0d9e0d9e0d9e0d9e0d9e0d9e0d9e0d9e0d9e0d9e0d",
          "replicas": 1,
          "running_since": "2026-10-02T03:10:00Z",
          "version": "v0.5.21",
          "commit": "d73f40430000000000000000000000000000000d",
          "signature": {
            "status": "verified",
            "checked_at": "2026-10-02T03:15:00Z",
            "signer_workflow": "https://github.com/dannyota/aboutme/.github/workflows/release-images.yml@refs/tags/v0.5.21",
            "transparency_log_index": 2965228543
          },
          "sbom": {
            "status": "not_found",
            "format": null
          },
          "links": {
            "commit": "https://github.com/dannyota/aboutme/commit/d73f40430000000000000000000000000000000d",
            "release": null,
            "build": "https://github.com/dannyota/aboutme/actions/runs/36218940587/attempts/1",
            "provenance": "https://api.github.com/repos/dannyota/aboutme/attestations/sha256:9e0d9e0d9e0d9e0d9e0d9e0d9e0d9e0d9e0d9e0d9e0d9e0d9e0d9e0d9e0d9e0d?predicate_type=provenance",
            "sbom": null,
            "transparency_log": "https://search.sigstore.dev/?logIndex=2965228543"
          }
        }
      ]
    },
    {
      "name": "web",
      "image": "ghcr.io/dannyota/aboutme-web",
      "running_images": [
        {
          "digest": "sha256:a41ba41ba41ba41ba41ba41ba41ba41ba41ba41ba41ba41ba41ba41ba41ba41b",
          "replicas": 1,
          "running_since": "2026-10-02T03:11:00Z",
          "version": "v0.5.21",
          "commit": "d73f40430000000000000000000000000000000d",
          "signature": {
            "status": "verified",
            "checked_at": "2026-10-02T03:15:00Z",
            "signer_workflow": "https://github.com/dannyota/aboutme/.github/workflows/release-images.yml@refs/tags/v0.5.21",
            "transparency_log_index": 2965228543
          },
          "sbom": {
            "status": "verified",
            "format": "spdx-2.3"
          },
          "links": {
            "commit": "https://github.com/dannyota/aboutme/commit/d73f40430000000000000000000000000000000d",
            "release": "https://github.com/dannyota/aboutme/releases/tag/v0.5.21",
            "build": "https://github.com/dannyota/aboutme/actions/runs/36218940587/attempts/1",
            "provenance": "https://api.github.com/repos/dannyota/aboutme/attestations/sha256:a41ba41ba41ba41ba41ba41ba41ba41ba41ba41ba41ba41ba41ba41ba41ba41b?predicate_type=provenance",
            "sbom": "https://github.com/dannyota/aboutme/releases/download/v0.5.21/aboutme-web.spdx.json",
            "transparency_log": "https://search.sigstore.dev/?logIndex=2965228543"
          }
        }
      ]
    },
    {
      "name": "caddy",
      "image": "ghcr.io/dannyota/aboutme-caddy",
      "running_images": [
        {
          "digest": "sha256:ca44ca44ca44ca44ca44ca44ca44ca44ca44ca44ca44ca44ca44ca44ca44ca44",
          "replicas": 1,
          "running_since": "2026-10-02T03:12:00Z",
          "version": "v0.5.21",
          "commit": "d73f40430000000000000000000000000000000d",
          "signature": {
            "status": "verified",
            "checked_at": "2026-10-02T03:15:00Z",
            "signer_workflow": "https://github.com/dannyota/aboutme/.github/workflows/release-images.yml@refs/tags/v0.5.21",
            "transparency_log_index": 2965228543
          },
          "sbom": {
            "status": "verified",
            "format": "spdx-2.3"
          },
          "links": {
            "commit": "https://github.com/dannyota/aboutme/commit/d73f40430000000000000000000000000000000d",
            "release": "https://github.com/dannyota/aboutme/releases/tag/v0.5.21",
            "build": "https://github.com/dannyota/aboutme/actions/runs/36218940587/attempts/1",
            "provenance": "https://api.github.com/repos/dannyota/aboutme/attestations/sha256:ca44ca44ca44ca44ca44ca44ca44ca44ca44ca44ca44ca44ca44ca44ca44ca44?predicate_type=provenance",
            "sbom": "https://github.com/dannyota/aboutme/releases/download/v0.5.21/aboutme-caddy.spdx.json",
            "transparency_log": "https://search.sigstore.dev/?logIndex=2965228543"
          }
        }
      ]
    }
  ],
  "observer": {
    "version": "v0.5.21",
    "commit": "d73f40430000000000000000000000000000000d",
    "source": "self-reported"
  }
}
